"","message","likes_count","comments_count","shares_count"
"652","more footage of the big wheel at galway christmas market, which got stuck with 20 passengers on board. emergency services attended the scene, and nobody was injured. (video: joe o'shaughnessy).",207,70,86
"653","the big wheel at the christmas market is stuck, with people on board. fire and rescue galway and garda are at the scene. (video: enda cunningham)

http://connachttribune.ie/fire-services-work-rescue-passengers-stuck-big-wheel-440/",914,999,922
"656","the queue outside the hole in the wall in galway this morning waiting to celebrate christmas day. (video: enda cunningham)",1575,805,209
"660","the m6 motorway has been closed in both directions since lunchtime, after a truck overturned and shed its load across the carriageways.",107,56,27
"662","a teenager has been given a four-month prison sentence for spitting at a garda like an animal.",129,42,31
"663","irish water says water supply has now been fully restored to all customers in galway city, where hundreds of homes and businesses were affected.",13,6,2
"664","training at the claddagh basin for wires crossed galway 2020, one of the anchor projects of galway 2020 european capital of culture, produced by galway community circus, which aims to train some 400 people in the art of funambulism (tight wire walking) over the coming years leading to a major world record spectacle of crossing the river corrib. wires crossed intends to highlight the importance of both physical and mental health by bringing this dynamic art form to all corners of europe. (video: joe o'shaughnessy)",395,46,201
"669","all the colour and magic of the 2017 macnas parade in galway captured through the lens of photographer joe o'shaughnessy.

galway 2020 european capital of culture the latin quarter galway nui galway bram stoker festival, dublin",494,50,563
"671","it's all go, as well as good humour, at the macnas workshop as the team prepare for their halloween parade, port na bpca (song of the spirits), which takes place through the city streets this sunday, october 29 starting from nui galway at 5.30pm. the following day, monday, their parade, memory song, will close the bram stoker festival, dublinl. (video: joe o'shaughnessy) 

galway 2020 european capital of culture the latin quarter galway galway chamber galway city business association an pucan busker brownes bar & kirbys restaurant the house hotel seven bar galway",107,21,78
"672","this mornings high tide in salthill and spanish arch, thankfully the gusts had died down, so there was only some over-topping of waves. if youre on the road this morning, watch out for spot flooding. (video: enda cunningham) 
#stormbrian",174,18,77
"673","after ex-hurricane ophelia, a bit of rain didnt deter the children from getting out and about. treat the family to a heart-warming weekend of magical fun for the final days of baboro international arts festival for children which runs until this sunday, october 22 around galway. see baboro.ie for more details. 

video: children in high street on their way in the rain and arriving at an taibhdhearc for ""what does red do on a thursday?"" by thalias kompagnos in germany. 

at galway city museum ireland children explore what kind of town theyd like to live in at the planning through time interactive installation with alison maccormaic. 

at nuns island theatre, children attend the colourful ""world images from theatre madam bach in denmark"". 

at galway arts centre on dominick street, pupils from inis mr attend exhibitions by maeve clancy. ""the moon belongs to everyone"" looks at journeys of child migrants and how to feel safe while moving through unknown spaces to a new home. (video: joe o'shaughnessy)
galway 2020 european capital of culture the latin quarter galway",57,3,16
"674","the aquadam in place for this evenings high tide. the next high tide  which is likely to lead to flooding  is around 6am. an orange weather warning is in place for winds up to 80km/h and gusts up to 130km/h. (video: enda cunningham)",115,18,33
"675","the army and galway city council crews deploying the water-filled aquadam at spanish arch this evening in preparation for #stormbrian. sand bags are being deployed by the army at locations around grattan and salthill. high tide is 6am, so biggest risk is between 5am and 7.30am. (video: enda cunningham)",487,62,180
"676","congratulations to hooked, galway recently named  georgina campbell's ireland seafood restaurant of the year  2018
pictured receiving their award are, left to right: nuisin and ali  jalivand, joint owners of hooked restaurant and alis fish, henry st. galway with georgina campbell.",170,16,21
"678","plans to provide a commercial development along with a bar and restaurant at the junction of the clybaun road and western distributor road have been refused by the higher planning authority.",21,12,0
"679","ex-hurricane #ophelia in salthill (video: joe o'shaughnessy)",145,17,109
"680","around 100 storm-related posts since we posted the first #ophelia warning for galway on saturday lunchtime. thank you to all the agencies for their co-operation in providing official information to us, and to our facebook community for sharing photos, videos and information to help keep people safe. 
spare a thought for the esb crews who will be working around the clock in atrocious conditions to restore power to 330,000 customers around the country, including around 7,000 in galway, and to emergency and local authority workers who are on duty through the night attempting to get roads reopened.
and rip to those who lost their lives today.",319,5,11
"681","9pm: galway city roads update: 

the promenade in salthill remains closed both ways until further notice between grattan rd and the golf course and gardai are warning people to stay away from the salthill area as conditions are extremely treacherous & flooding is likely. 

there is surface water on numerous roads in the claddagh as well as fr. griffin rd at the spanish arch and the dock rd and road users should avoid these routes where possible.

the coast rd (r338) is passable again between oranmore and the city however it is likely to flood again so motorists should drive with extreme care.",76,9,21
"682","the latest on road closures from galway county council
#ophelia-",188,46,193
"683","the aftermath of #ophelia in salthill (video: enda cunningham)",231,50,187
"684","toft carpark in salthill under water this evening (video: rossa meade)
#ophelia",251,166,549
"685","the sea flowing onto salthill promenade (video: paul obrien)",153,37,150
"686","flooding at the claddagh (video: joe carroll)
#ophelia",265,137,313
"687","flooding at toft park in salthill (video: carol barros)",287,213,436
"688","flooding at spanish arch 
#ophelia
(video: danica gutierrez)",333,242,312
"689","flooding at toft carpark in salthill (beside the aquarium) (video: caroline barros)",54,20,39
"690","barna pier at the moment.",81,22,56
"691","2:15pm: county galway trees on roads:

l-7424  deerpark tree down, road closed
l3107 1 mile from monivea on athenry road. tree down, road closed
r347 glenamaddy side of buibheanach bridge. tree partly blocking lane. passable.
r347 near castle ellen house. tree down, road closed.
r348 eskerroe. trees down, road closed
l-8408 carrowmore. tree leaning on esb wires. passable.
r348 athenry to derrydonnell. tree down. road closed.
l-7268 drinaun. tree down, road closed",177,85,221
"692","things are really beginning to pick up at galway harbour (video, captain brian sheridan, harbour master).",259,88,166
"693","preparations being finalised in salthill ahead of the brunt of #ophelia",279,44,99
"694","please stay away from coastal areas. the council has asked people to stay off salthill prom from 11am when it will be closed to traffic. emergency services will have enough to deal with without having to rescue people taking photos.",275,20,42
"695","businesses in salthill prepared for the worst later day. #ophelia",97,21,35
"697","#ophelia update from met ireann",338,167,497
"699","the reaction in athenry after the commercial court's decision in apple's favour. (video: joe o'shaughnessy)",530,47,90
"701","macnas ceo noeline kavanagh talks about the forthcoming parade at the macnas headquarters in the fisheries field. yvette picque, barra convery and caroline okwonko bring colourful parade characters to life in the the latin quarter galway. they are graduates of the macnas young ensemble troupe, and will take part in this years halloween , macnas parade, galway 2017 - port na bpca (song of the spirits), on sunday october 29 starting from nui galway at 5.30pm. the following day the parade will close the bram stoker festival, dublin. (video: joe o'shaughnessy)",90,7,91
"705","the man whose body was found washed up on a beach on inis mein has been identified as a man who fell into the sea in co. clare a fortnight ago.",39,20,3
"706","free competition in this week's connacht tribune - 
win a 2 night break for two in the 4-star fitzpatrick castle hotel, killiney, co. dublin.
entry form only in this thursday's connacht tribune.",10,1,2
"708","the medieval tournament in claregalway castle this weekend. (video: joe o'shaughnessy)",61,8,55
"709","why the long faces? all the colour from the ballinasloe horse fair today (video: joe o'shaughnessy)",600,164,392
"712","jaw breakers ... fuel storage tanks at galway docks being torn down today (video: joe o'shaughnessy).",224,63,71
"713","actor sean mcginley back at the druid theatre company where he took time out from rehearsals for cast and crew photographs. he plays scober macadam in the druid production of 'king of the castle' by eugene mccabe. sean, an integral company member since druid's foundation, talks about the theatre, galway and 'king of the castle'. it runs from friday night until october 7 in the town hall theatre galway. (video: joe o'shaughnessy)",25,3,14
"715","a special meeting will be held this friday in a bid to overturn a decision by the county council to maintain the local property tax at the same rate as last year.",12,10,2
"716","eyre square earthquake ... a digital animation produced by oxfam ireland to give people a greater perspective and appreciation of what millions of people around the world are facing today.",75,36,34
"717","an organisation that provides aid for men suffering from domestic abuse is introducing a monthly outreach clinic in galway city.",179,11,40
"718","gas networks ireland has announced that galway city, oranmore, salthill and claregalway are safe to resume using gas.",30,9,7
"720","mouth cancer awareness day
wednesday,  20 september
mouth cancer is an important global healthcare problem. there are more than 300 cases of cancer of the mouth (oral cavity and pharynx) reported in ireland every year. these cancers are more common in men than in women. however this is changing.

the incidence rate of cancer of the mouth in women has increased significantly at a rate of 3% per year since 1994. it mainly affects older people although younger people are being diagnosed now. in britain, the incidence of mouth cancer has increased faster than any other cancer in the past 25 years.

according to the national cancer registry in ireland, roughly half of all mouth cancers and even less of cancers of the pharynx are diagnosed at an early stage.

this can result in more complex treatment with greater impact on quality of life and overall survival. whilst it depends on the cancer site we know that more than half of those treated will have good survival outcomes and this continues to improve each year.

early detection of mouth cancer greatly improves the chances of survival.

dentists have a key role to play in the early detection of mouth cancer and in the prevention of the disease by identifying those patients who are exposed to risk factors.

mouth cancer awareness day is wednesday, 20 september 2017

please consult your dentist during your routine dental visit about a mouth cancer examination - taking 10 minutes that could save your life.",19,1,14
"721","a motorist had a lucky escape this evening after his car ploughed through railings into the eglinton canal. he was uninjured.",228,173,108
"724","a colourful sunset over salthill this evening (photo: cathy gill)",269,6,19
"725","it's a wild night for walking salthill prom ... gusts of up to 110km/h are forecast to continue overnight, with very heavy rainfall. (video: enda cunningham)",572,218,276
"726","braving the wind and rain (but there was some sunshine too!) at today's annual galway memorial walk in aid of galway hospice. and the liam mccarthy and irish press cups also made an appearance! (video: joe o'shaughnessy)",504,34,62
"727","people in need of orthodontic care in county galway can wait as long as three-and-a-half years before receiving treatment.",19,10,4
"728","a business representative group from tuam is to meet with senior galway county council officials next week in an effort to reignite economic development in the town.",92,5,5
"729","the annual galway zombie walk from eyre square to the spanish arch in aid of jigsaw galway. 
jigsaw galway is a free, non-judgemental and confidential support service for young people (15-25) living in galway city and county. they provide guidance and support for young people who are going through a difficult or distressing time. they also provide advice and guidance for anyone concerned about a young person in their life or work. (video: joe o'shaughnessy)",226,50,57
"730","this years christmas market will repeat the 2016 changed layout  off the grass in eyre square  after the tender was awarded to the same operator as the past six years.",309,61,17
"737"," homecoming  the senior hurlers' dance moves on stage made it all worthwhile for the 30,000+ supporters who came to pearse stadium last night to join in the all-ireland celebrations!! well done to everyone who came out to support the two teams. (video: joe o'shaughnessy)",2409,223,855
"738"," the all-ireland winning galway teams take the stage in front of thousands of supporters in pearse stadium tonight. (video: enda cunningham) ",1430,40,530
"739","the galway minors homecoming in pearse stadium",313,7,48
"740","there's no show like a joe show! ",297,1,27
"742"," galway, all-ireland minor and senior hurling champs 2017  the reaction in eyre square at the final whistle.",1674,193,511
"743","standing ovation in eyre square for the late, great tony keady in the 6th minute.",315,7,37
"744"," thousands of supporters gathered in eyre square for the all-ireland final",1258,36,294
"745","countdown to glory ...",141,1,42
"746","our date with destiny ...",310,5,94
"747","croker looking in fantastic shape this morning.",90,1,4
"748"," melvin and fergal smith, philip coleman and aidan ferguson are making their way from ballygar to croker. ",521,10,18
"749"," 3-year-old mason from portumna is a huge galway fan!",145,8,9
"750","anxious ... bella in christchurch, new zealand waiting for the big game. (photo: corinne mullins)",90,2,5
"751","safe travelling to everyone heading to croker in the morning!
 #gaillimhabu",1023,39,319
"752"," all set ... colm seoighe, connemara, with blthn and ninn ",416,16,35
"753","any spare tickets? (photo: louise treacy)",185,14,13
"754","gerry moloney, monivea, doing his bit for the tribesmen (photo: carole rabbitte)",164,9,12
"755","street party on mainguard street on thursday for the latin quarter galway minor and senior hurlers' road to glory. (video: joe o'shaughnessy)
tribesmen gaa",461,27,140
"759","don't miss this week's tribune for your souvenir 32-page all-ireland final supplement, with previews of the seniors and minors; extensive pen pictures of all galway players; interviews with management and the waterford camp; neutral analysis from davy fitz, and much more.",69,4,24
"760","bermuda calling .... the p&o cruise ship 'oriana' waiting for the tide at mutton island this morning. it has a capacity for 1928 passengers and 794 crew. pic: d. mcguire",108,4,9
"761","there were record numbers of rough sleepers on the citys streets this summer, fresh figures from a local homeless charity confirm. some 85 rough sleepers were in contact with cope galway homeless services this july.",41,22,9
"762","plans for significant expansion works at the connemara hostel at killary  including new bedrooms with grass roofs and glamping facilities  have been lodged with galway county council.",40,0,6
"764","so where is open in galway this evening? just a quick check on middle street, via mara restaurant is open from 6pm with food to warm the heart and the tummy, also milano and the dil, and around the corner, pints available at the bunch of grapes and neachtans. anywhere else?",48,25,7
"765","the beauty of the beast! barna woods earlier. stay warm and safe everyone, theres more on the way.",93,4,7
"766","fair play to the corofin boys, into another all ireland senior club final, with a 1 - 6 to 0 - 6 over moorefield this afternoon. congratulations lads, best of luck in the final!",22,0,0
"767","its another frosty one this morning in galway. you may need to allow a couple of minutes to clear that windscreen if youre planning to drive. looks set for a bright sunny day though. have a great day!",26,2,2
"768","another great win for galway over mayo this afternoon in the allianz football league. it ended galway 1 13, mayo 0 11 at pearse stadium. congratulations lads, thats three wins out of three in the league so far for galway.",124,12,3
"769","great effort by liam mellows this afternoon but they were beaten by cuala 1 17 to 0 11 in the all ireland club senior hurling semifinal in thurles. great year for the liam mellows club, well done lads!",43,3,1
"770","gorgeous morning over the river corrib captured recently by samus o'donoghue photography.",56,2,5
"771","the lights are on but nobody's home. glenlo abbey hotel looking gorgeous at night snapped recently by nathan wynne.",86,4,4
"772","silverstrand captured recently by martin o grady.",80,3,5
"773","sunset at blackrock. photo thanks to martin o grady.",41,0,8
"774","good morning and happy galway independent day! photo: cathy gill.",87,2,12
"775","rainbow at silverstrand snapped recently by martin o grady.",30,0,3
"776","talented local artist aisling kearney from beechmount art studio in turloughmore has created this stunning painting to mark galways all ireland victory.",102,2,13
"777","hermitage green are playing a free gig in sult nui galway tomorrow (wednesday 6 september). this is for the students of nui galway. tickets will be available from the bar this afternoon. terms and conditions do apply and full information is on the sult facebook page.",6,0,0
"778","the galway teams visiting crumlin children's hospital yesterday.",110,4,0
"779","the celebrations will continue this evening when all-ireland winning galway captain david burke brings the liam maccarthy come back to his home club and minor player darren morrissey takes the irish press cup home to sarsfields.  ",71,0,0
"780","a massive crowd turned out to welcome home our hurling heroes last night. photo: boyd challenger.",61,0,8
"781","an independent city councillor has called on the local authority to revise and improve their policy in relation to communicating with the public.",0,1,0
"782","were you in pearse stadium last night to welcome home our all ireland champs?  #gaillimhabu thanks to samus o'donoghue photography for sending this our way.",24,0,6
"783","good morning galway! photo: johanna n mhille.",43,1,3
"784","autumn in galway  photo: martin o grady.",31,0,2
"785","this was the crowd over an hour ago. up galway!",24,3,0
"786","the west is truly awake tonight! the galway team are making their way into pearse stadium where they will get a rapturous reception. #upgalway",14,0,0
"787","the teams are hoping to be in pearse stadium by 7pm. traffic is very heavy across the city at the moment.",15,3,1
"788","amazing crowd turned out to watch the match in eyre square yesterday. crowds in their thousands turned out in ballinasloe to welcome home our winning heroes. they are about to leave ballinasloe and make their way to pearse stadium where an even bigger crowd is expected.",50,3,0
"789","the minor and senior teams will be leaving ballinasloe in the next 10 minutes to make their way to pearse stadium.",21,4,3
"790","nui galway today announced that professor ciarn  hgartaigh has been appointed the 13th president of the university with effect from january 2018.",27,3,2
"791","up galway! pictured is bunty, a big galway fan who is a staff member of railway veterinary clinic loughrea and is owned by vet nurse edel callanan.",68,5,15
"792","alf stewart from home and away is celebrating galway's win!! #gaillimhabu",779,42,0
"793","one of galways biggest supporters! thanks to nancy parker for sending this in.",32,1,3
"794","galway manager michel donoghue celebrates with his sons niall, cathal and cian after the gaa hurling all-ireland senior championship final match between galway and waterford at croke park in dublin. photo by brendan moran/sportsfile",794,7,18
"795","homecoming timetable: 
ballinasloe for civic reception for 3pm
then straight to pearse stadium for 6:30pm",13,1,7
"796","one of the most touching moments of the whole day. margaret keady, wife of the late tony keady with the liam maccarthy cup. pictured with her are galway captain, david burke, left, and joe canning after the gaa hurling all-ireland senior championship final match between galway and waterford at croke park in dublin. photo by ray mcmanus/sportsfile",607,10,19
"797","let's take a minute to thank this man. galway manager michel donoghue after the gaa hurling all-ireland senior championship final match between galway and waterford at croke park in dublin. photo by seb daly/sportsfile",287,6,20
"798","where were you when galway won the 2017 all ireland hurling final? electric atmosphere in eyre square yesterday - a day that will live long in the memory #gaillimhabu",25,1,5
"799","joe canning and his nephew jack canning of the galway minor team celebrate their respective all-ireland victories following the gaa hurling all-ireland senior championship final match between galway and waterford at croke park in dublin. photo by stephen mccarthy/sportsfile",256,5,14
"800","good morning galway  another week beckons! thanks to tracy morris photography for sending this pic our way.",23,0,0
"801","garda at galway are seeking the public's help in tracing the whereabouts of 16-year-old luke adams, who is missing since last friday.",15,5,52
"802","there are no monday blues in galway today! liam maccarthy is heading west.",233,1,26
"803","man of the match goes to david burke galway's captain. fantastic achievement for him.",126,7,3
"804","the sunday game hurler of the year is galway's number 6 gearoid mcinerney. he had a fantastic season for galway. congrats gearoid.",231,2,4
"805","this is a special day for the families and friends of all the players. pictured are joe canning's parents beaming after galway's glorious win.",2918,98,141
"806","the new turbines at cloosh valley near oughterard in co. galway. photo courtesy of mark white.",8,1,2
"808","joe canning celebrates with former galway hurler john connolly. photo: sportsfile",1484,39,183
"809","let the celebrations begin. photo: sportfile",35,1,1
"810","we will never tire of this photo. galway's captain david burke lifts the liam mccarthy cup.",1696,47,390
"812","a special moment. unforgettable.",27,1,5
"813","we are all ireland champions at last. this is an emotional time for every galway person everywhere. #gaillimhabu",179,0,15
"814","no. 1 monalee heights, ballymoneen road, knocknacarra has come on the market.",3,0,0
"815","half time: galway 0-14 waterford 2-7. galway lead by one. what a great game so far but so so close. #gaillimhabu",0,0,3
"816","wonderful tribute to the late tony keady with a massive applause across croke park on the sixth minute.",131,1,0
"817","absolutely fantastic start by galway. #upgalway",6,0,0
"818","here we go! very best of luck to the galway team. go do it! #gaillimhabu",22,0,2
"819","beauty expert caroline bourke gives her advice on achieving the no make-up look.",0,0,0
"820","the late great hurler tony keady would have been in croke park today willing on the galway team. his sudden passing was a shock to everyone in galway hurling and beyond. today, we take a moment to remember him. photo: ray mcmanus/ sportsfile",154,1,3
"821","memorials of passchendaele is the focus of this weeks talking history column.",2,0,0
"822","good morning galway. an old cottage in connemara snapped recently by martin o grady.",16,0,2
"823","there is only thing on the minds of all galway supporters today. best of luck to the minors and seniors in the all ireland finals.  #gaillimhabu",136,1,19
"824","beautiful evening swimming and paddle-boarding as night falls in salthill. thank you to richie owens for sending this our way recently.",57,2,3
"825","the 1988 winning galway team: back row, from left to right, brendan lynskey, pete finnerty, michael coleman, anthony cunningham, john commins, tony keady, martin naughton and pat malone. front row, from left to right, michael mcgrath, joe cooney, connor hayes, sylvie linnane, gerry mcinerney, ollie kilkenny and eanna ryan. photo: ray mcmanus / sportsfile",235,1,22
"826","founder and ceo of complete laboratory solutions (cls) evelyn otoole will speak at the upcoming female empower programme launch at the connacht hotel.",7,0,0
"827","ireland play georgia in a world cup qualifying match today. pictured are some supporters who travelled to tbilisi to support the boys in green. photo by david maher/sportsfile",10,0,0
