"","message","likes_count","comments_count","shares_count"
"189","statement from health minister simon harris:

i want to pay tribute today to our outstanding health service staff all over the country for their incredible dedication and commitment.

they are going to huge efforts to keep vital services open and ensure patients are looked after in very difficult conditions. from across ireland i have heard stories today of health care workers walking to work, staying past their shifts, sleeping in hospitals overnight, and going above and beyond the call of duty to ensure their patients get the care they need.

i would also like to thank our paramedics for transporting patients in very difficult conditions, civil defence staff for helping deliver crucial medication and the defence forces for transferring dialysis patients and medicines, as well as helping our dedicated health staff to get to work safely.

let us all support our committed health care staff by ensuring we keep emergencies for emergencies.

i would also like to take this opportunity to appeal to people to check in on your vulnerable friends, relatives and neighbours, when its safe to do so, to make sure they are well and warm.""",449,36,66
"190","galway girl in knocknacarra ready for the galway races and another great year of hurling. (photo: nra n ghrofa)",123,7,2
"191","white-out . . . abbeyknockmoy this morning (photo: fergal king)",222,11,35
"192"," children in salthill park taking advantage of snow day (video: joe oshaughnessy)",433,27,96
"193","galway bay golf resort captured by drone today by gearoid hawkins",287,20,40
"194","coorbaun, loughrea under a blanket of snow (photos: gemma fahy)",100,5,11
"195","the snow on salthill prom is getting quite heavy now. -2.5c at 2pm.",334,35,87
"196","stunning ... the approach road to silver strand, photographed by brian corcoran.",1164,61,115
"197","garda have said they have had no report of the discovery of a body at the public toilets in eyre square, contrary to posts on social media over the past 24 hours.",109,61,59
"198","due to the current national weather situation, the nui galway alumni awards gala scheduled for this saturday, 3rd march has been cancelled.  while the nui galway campus is scheduled to reopen on saturday, in the interests of the safety of alumni who may be travelling significant distances to the event, the gala will be rescheduled.",10,0,3
"199","all dunnes stores outlets in the republic and north will be closed today and will remain closed until 1pm friday. this reopening time is subject to change.

all tesco ireland stores will close at 2pm today, and will re-open at 1pm friday. this reopening time is subject to change.

all lidl stores in the republic of ireland will close at 3pm today and re-open on friday afternoon.

all aldi stores will close at 1pm today and reopen at 5pm tomorrow.",129,39,115
"200","irish rail update:
the final local services today will be:

11:05hrs galway to dublin heuston
12:30hrs dublin heuston to galway (special, changed from 1pm)
western rail corridor: 10.00hrs ennis to galway 
10.30hrs galway to ennis",18,7,12
"201","hospitals update:

following the upgrade of the weather warning last night by met eireann to status red for the entire country today (thursday march 1st), galway university hospitals (university hospital galway and merlin park university hospital) and portiuncula university hospital have cancelled routine electives and outpatient appointments today and tomorrow (friday 2nd).
 
the hospitals are putting arrangements in place to ensure the continuation of essential services for chemotherapy and dialysis patients as well as those coming in for urgent surgery. these patients are being prioritised at this time and are being contacted by the clinical teams in relation to appointments/procedures planned for today and tomorrow. in circumstances where patients are unable to travel, alternative dates will be provided as soon as possible.  
 
in relation to the renal service in merlin park, we are in contact with transport providers for dialysis patients with regard to the weather conditions. patients will be contacted individually and decisions will be based on clinical need and the travel advice from the national emergency co-ordination group.
 
we will continue to do everything possible to maintain all essential services to patients receiving planned cancer and renal services. all appointments cancelled during this period will be rescheduled and we will be in contact directly with patients to reschedule their appointments.
 
patients should be advised that if they do attend the hospital today for a clinic appointment they will be seen.

where possible, radiotherapy patients should attend for their scheduled treatment in uhg.
 
the hospitals emergency departments continues to be busy and we expect difficulties around discharge planning as a consequence of the adverse conditions.
we would ask that patients who are being discharged today are collected from the hospital as early as possible to avoid travelling during the worsening conditions forecast for this afternoon
 
we would encourage people to consider all options available to them for their healthcare needs and to protect the ed for those most seriously ill as delays can be expected.
 
guh and puh are working closely with colleagues in the community health organisations and with the national ambulance service.",86,16,75
"202","today's scheduled o'donnellan & joyce property auction has been postponed until march 9 due to the weather.",6,0,0
"203","due to the status red weather alert, the offices of the connacht tribune will be closed tomorrow, friday 2 march",14,0,2
"205","the national transport authority has identified a potential site at the coolagh roundabout in galway  just off the end of the motorway  for a park and ride facility.",28,8,2
"222"," its currently -4.8c in galway city, and road conditions, footpaths are reported as treacherous in many parts of the city and county.",200,30,77
"226"," all bus ireann and expressway services nationwide are cancelled.

gobus galway-dublin-airport services cancelled 

burkes bus running as of 6.40am, but they are reporting poor conditions from corofin crossroads to galway city, so expect delays and check their website.",88,27,62
"227"," all schools, third level institutions and colleges of further education nationwide will be closed tomorrow and friday, as instructed by the minister for education due to the status red weather warning.",558,211,435
"228"," status red snow/ice warning 

met ireann has just upgraded the red warning nationwide

 all schools, third level institutions and colleges of further education will be closed tomorrow and friday, as instructed by the minister for education due to the status red weather warning. 

further heavy snow showers will bring accumulations of significant levels with all areas at risk.
blizzard conditions will develop from the south thursday afternoon and evening as heavy snow and strong easterly winds bring snow drifts northwards over the country. eastern and southern coastal counties will be worst affected.

the warning is in place from now until 3pm friday.",777,730,1314
"229","the front page of this weeks connacht tribune. in shops from early thursday morning or to buy online at:

http://connachttribune.ie/digital-editions",8,0,2
"230","update 11pm: status red warning now in place nationwide

city council weather update:

galway city councils weather assessment and response team has met each day this week to assess the current and forecasted situation regarding the current snow and ice warnings and other weather related issues. the team met again on wednesday afternoon with members of the senior management team of gcc in attendance. an assessment of the current situation follows along with the actions being undertaken by city council staff.
 
weather
there are 2 weather warnings (www.met.ie)  in place that apply to galway city:
          a status orange warning for snow ice for galway valid from 5pm wed. 28th feb. to 12noon on thurs 1st mar.  
         a status orange warning for snow ice for connacht valid 8pm on thurs. 1st mar. to 12noon on fri. 2nd mar. this warns of persistent snow showers in this period which together with strong easterly winds may lead to snow drifts.
 
the 2 status red warnings in place do not apply to galway.
 
weather assessment
 
severe weather (ice/snow)
         5 -day rainfall and temperature forecasts were assessed (www.met.ie).
         temperatures are expected to fall below 0 (freezing) in coming days with temperatures expected to fall as low as -4 degrees on the morning of thurs. 1st mar.
         light precipitation is forecast from evening of wed. 28th feb.  increasing to light-medium by morning of fri. 2nd mar. coupled with low temperatures this precipitation will most likely be snow.  
 
high tides
         the opw issued a high tide advisory notice for the period of thurs. 1st mar. to mon. 5th mar.
         galway city council are aware of the period of the current period of very high astronomical spring tides.
         the highest astronomical tide in this period will occur on sat. 3rd mar. 18  accurate predicted water levels are not yet available for this date.
 
 
actions/measures in place:
 
         the winter maintenance programme for roads across the city is on-going. it is intended that salting operations will take place 7-9pm tonight and again at 5am tomorrow morning (thurs. 1st mar. 18). the situation will be monitored for following days. galway city council has an ample supply (and reserve stock) of salt.
         requests have come in for salting on roads in estates and carparks in churches (in advance of religious events at the weekend).  the roads section will facilitate such requests as best as possible.
         the main pedestrianised streets in the city centre will be salted on thursday morning and the status of the streets will be monitored thereafter.
         the roads section will monitor water levels and keep in contact with the harbour master during this period of high astronomical spring tides
         the aquadam bund at fishmarket  will be partially inflated and roads crews will be on standby (for road closures etc.) in the event of overtopping/flooding due to tides particularly early on saturday morning 3rd march.
           a follow up meeting of the weather assessment team is scheduled for 2.30pm on thurs. 1st mar. 18",60,36,37
"231","garda are investigating an armed robbery at derrydonnell filling station near athenry.",90,95,78
"232","the stunning will be brewing up a storm in the big top at galway international arts festival this summer. the galway band has been announced to play on sunday, july 22, with special guests the academic. tickets go on sale (35) tomorrow morning (thursday) at 9am from giaf.ie and roisindubh.net",217,87,21
"233","galway city council has sought more information on plans for a change of use of five apartments over oreillys bar in salthill for use as a boutique hotel.",19,5,5
"234","a heroin addict has been given a suspended sentence for stealing money from a church poor box using the spoke of a bicycle wheel with sticky tape attached.",50,25,41
"235","12 garda stations in galway have no access to the pulse, the computer system used to log and track crimes and criminals in ireland.",14,12,5
"236","the restoration of ballyglunins railway station has attracted international attention. in this weeks community matters, stephen corrigan meets the committee behind the project which, they say, is ultimately a community-based project for the improvement of the area.",56,3,4
"237","the irish embassy has ruled out a suggestion that the all-ireland winning galway hurlers visit trumps white house for st patricks day.",42,19,4
"238"," with the beast from the east set to hit ireland in the coming week, this is a look back at the big snow of 1947 from the connacht tribune archives. a thick blanket of snow in renmore.",176,18,30
"239","a gort man, who donated a kidney to his brother nearly a year ago, is organising an event in aid of the irish kidney association next saturday.",380,4,49
"240","the fish farm industry has been described as out of control after it was confirmed that salmon farm owners in the west of ireland failed to report potentially harmful escapes to the authorities, despite being legally obliged to.",29,9,11
"241","a staggering 10 million is to be borrowed by galway county council to spend on refurbishing their stock of local authority houses over the next five years.",21,8,1
"242","three teenage boys have been sent forward for trial charged with a spate of armed muggings which occurred at or near student accommodation at the headford road area of the galway city last september.",60,31,15
"243","families face being split up from next year if the department of educations directive for tuam educate together primary school to accept no more than 13 pupils is implemented.",25,1,11
"244"," met ireann is forecasting exceptionally cold weather for next week, with significant wind chill and severe frosts. disruptive snow showers are also expected from tuesday, especially in the east and south of the country, but they may hit the west.

please check in on elderly relations and neighbours and make sure theyre ok for fuel and any other supplies they may need. also, make plans where necessary for animals and livestock.",138,16,85
"245","galway united f.c. are off to a winning start in the first division. a hat-trick from new signing, danny furlong (pictured), along with a ronan manning strike, saw them record a 4-1 win at home to athlone town tonight, with the visitors grabbing a consolation goal in the second minute of second-half injury time.",58,1,5
"246","the mayo association galway will hold their annual dinner dance on saturday, march 10th in the galway bay hotel, salthill. special tribute will be paid to alan dillon on his retirement from county football. tickets are 50.",24,26,0
"261","the front page of this weeks galway city tribune. in shops from early friday morning or to buy online at:

http://connachttribune.ie/digital-editions",8,2,0
"262","a young lady, understood to be aged in her late teens, has died after being rescued from the water at blackrock in salthill this morning. rip.",144,111,41
"263","update: a lady, believed to be in her late teens, has died after being rescued from the water at blackrock this morning,.",71,36,24
"265","after nine weeks in a tortuous battle against the harshest elements, totally dependent on his meticulous preparation and his own wits, solo atlantic rower damian browne has discovered the most important lesson in life: never give up.",87,0,3
"266","local business leaders are hopeful that the governments new project ireland 2040 plan will transform the regions economy by improving connectivity along the entire western seaboard.",2,2,1
"278","the front page of this weeks connacht tribune. in shops from early thursday morning or to buy online at:

http://connachttribune.ie/digital-editions",3,1,0
"279","congrats to calasanctius college oranmores u14 boys who were crowned all-ireland schools a basketball champions following a 51-27 win over st pats of cavan in the national basketball arena in tallaght this afternoon.",56,1,5
"280","investigations are underway after a hair salon and phone shop were broken into in gort overnight.",13,3,6
"281","three billboards outside leitir meallin, conamara. erected to celebrate director martin mcdonagh's success at the baftas for three billboards outside ebbing, missouri which won five awards. it is also nominated for seven oscars. the directors father is from the village and martin and his brother john michael (director of the guard) spent much of their childhood there. (video: joe o'shaughnessy)",192,20,43
"282","college students in galway are becoming drugs dealers as a means of funding their way through college, a court has been told. it reminds me of breaking bad, judge mary fahy said at galway district court after hearing evidence against three nuig students who, in separate and unrelated cases, pleaded guilty to drug dealing offences.",130,71,43
"283","the owners of a galway city nightclub and pub received hefty fines this week for breaches of smoking regulations on their respective premises and must also pay the costs and legal expenses of the hse, which prosecuted them.",93,27,14
"284","a student who stole mobile phones from six girls handbags in nightclubs was sent back to nigeria by his parents for a while so that he would come to appreciate the advantages he had been enjoying while growing up here in ireland.",259,41,24
"285","75 new jobs are in the pipeline for galway, with the establishment of a new business service centre by a californian company in the city.",41,6,8
"287","an bord pleanla has rejected a proposal for more than 110 homes on a site in bearna under new fast-track planning legislation  telling the developer there should be up to 200 homes on the site.",39,11,9
"288","a man was rescued by the rnli after a dinghy capsized on galway bay this afternoon.",46,0,8
"289","galway is to become a regional centre for the treatment of bulimia and anorexia.",221,17,23
"290","the chief executive of galway city council has strongly dismissed any rumours that a bus corridor will be built through merlin woods.",19,5,5
"291","members of nuig/gmit subaqua club at the galway atlantaquaria in salthill during their 30-hour fundraiser dive for galway lifeboat station. (video: joe oshaughnessy)",103,14,45
"292","the vast majority of official complaints made about galway taxis and hackneys last year related to overcharging, routes taken, rude drivers and queue skipping.",58,31,12
"293","photobombed in carraroe. look closely! (photo: cathy gill)",493,57,70
"294","the prospects of a luas-type tram system being provided in galway city have been derailed  the national transport authority has described it as a highly inefficient solution to the citys notorious traffic woes.",85,49,15
"295","galway city council is in the process of appointing a vacant homes officer who will oversee empty properties being brought back into the housing stock.",24,2,1
"304","congratulations to damian browne, who has just completed his 4,800km solo atlantic row challenge!",157,2,9
"305","it reads like a storyline from a marian keyes novel: a nurse from dunmore meets a norwegian dairy farmer on a sun holiday in the canary islands. they fall in love, marry, settle down on a tiny island in norway and have five children, one of whom goes on to represent ireland at the winter olympic games in south korea.",523,38,94
"307","work has begun this week on an extra turning left lane from parkmore west allowing traffic heading for the tuam road to bypass those queuing for the briarhill side.",47,13,9
"319"," more than 700 homes and businesses in tuam are without power tonight. esb networks expect service will be restored by around 11.30pm.",33,22,8
"320"," valentines 

claddagh swans photographed last year by cathy gill.",182,3,20
"321","the front page of this weeks connacht tribune. in shops from early thursday morning or to buy online at:

http://connachttribune.ie/digital-editions",27,1,4
"322","gardai conducted a forensic investigation in gort this morning after a pedestrian was knocked down and seriously injured last evening.",11,5,4
"323","update: **competition closed**

congratulations to the winner, louise fallon, we've messaged you.

 love is in the air giveaway 
 
we have a fantastic giveaway for all you romantic couples out there.
win a bunch of red roses & bottle of champagne 

to be in with a chance to win this prize, simply like and share this post.

the winner will be picked at 2pm today, and you can pick the prize up at the connacht tribune reception on market street. you must be over 18 and provide id. 
 
happy valentine's day",306,187,278
"324","over 9 million in new business secured by galway convention bureau 
galway convention bureau is a member led non-profit organisation, whose mission is to sell galway as a destination for international mice business (meeting, incentive, conference, events). the vision is to build a sustainable mice sector, contributing significantly to the galway economy, working in cooperation and providing service excellence to the market. 
the convention bureaus status was secured with the backing of filte ireland, shannon airport, galway city and county councils, the western development commission and trade memberships. along with the support of the galway branch of the ihf. 
the convention bureaus membership consists of venues, hotels, retailers, transport, restaurants, pubs, activities, attractions and airports. those wishing further information on the bureau can email: info@galwayconventionbureau.com or call 091 33 99 20.
front row l-r: ciara gallagher, failte ireland; darragh oconnor, chairperson, galway convention bureau; rose finn, manager, galway convention bureau. back row, standing: eveanna rya, connacht hospitality; brian barrett, galway county council;  ann duggan, nui galway; andrew murphy, shannon airport; paul mockler, failte ireland.",25,1,12
"325","the queue for #donegaltuesday at 10am",218,91,33
"326","the queue for #donegaltuesday on eyre street in galway at 9.30am, where it is currently 0c (photo: enda cunningham)",1012,338,78
"327","hes known across the county as one of galways highest profile auctioneers  but few know that before all that, martin tyrrell had another life down under, when he provided armed security for two prime ministers.",48,5,2
"328","a man returned to his isolated house in south galway to find two intoxicated burglars asleep in his bed, a court heard.",85,12,24
"329","incidents of stealing from cars and vans rocketed by 250% in the first month of the year, the latest crime figures show.",34,8,23
"330","if youre heading to pearse stadium, remember to park legally, as cars will be ticketed for parking on footpaths, yellow lines etc and may be towed if blocking access. garda are not obliged to place a ticket on your windscreen, you may get a fine in the post in the coming weeks.",27,6,3
"331","its snowing in salthill at the moment, but both games will go ahead in pearse stadium following a pitch inspection this morning. gaillimh ab!",70,6,15
"332","more than 2,000 people  including president michael d higgins  are set to attend the installation of bishop brendan kelly as bishop of galway and kilmacduagh today.",79,16,10
"333","bus ireann is investigating another allegation of racist behaviour by one of its drivers in galway.",42,22,18
"334","the city council has issued traffic advice ahead of two major events taking place in the city tomorrow (sunday).",35,20,25
"335","the story of orphan girls of mountbellew workhouse who travelled to western australia has long been forgotten. stephen corrigan meets paula kennedy who has been working to link their families in australia with their ancestral home.",137,9,45
"336","the cash-strapped galway-mayo institute of technology (gmit) is in talks with the department of education about buying crowley park from galwegians rfc.",65,25,13
"337","a pensioner was hospitalised after falling on a crumbling city footpath  and six days after it was reported, galway city council still hadnt carried out repairs.",54,29,23
"338","gary thornton was in seventh heaven this week. the city athlete ran seven marathons, on seven continents, over seven days  and won all seven races.",493,24,39
"339","consultants are scheduled to be appointed over the coming months to draw up the blueprint for a comprehensive flood defence scheme for key areas of the city.",24,7,3
"350","bradley bytes  the stick with which hardcore sinn fin members used to beat their representative in galway west, trevor  clochartaigh, with, was that he wasnt a true shinner.",4,3,1
"351","the front page of this weeks galway city tribune. in shops from early friday morning or to buy online at:

http://connachttribune.ie/digital-editions",16,2,4
"369","the front page of this weeks connacht tribune. in shops from early thursday morning or to buy online at:

http://connachttribune.ie/digital-editions",145,16,10
"370","the connacht tribune are recruiting:",8,5,5
"371","a syndicate of 18 staff members at the portiuncula hospital medical records office has scooped a lotto prize of 500,000.",878,114,41
"372","the man who died following a crash in loughrea town yesterday has been named locally. rip.",22,7,3
"373","a pensioner has died after his car collided with a steel barrier in loughrea this morning.",39,30,31
"374","plans to build 400 student beds on the site of the westwood hotel have stalled  with the hotel now set to remain in operation until at least september.",137,18,16
"375","planners have refused permission for a pop-up restaurant to be set up in steel shipping containers on a vacant city centre site  similar to those in the southbank centre in london.",26,46,6
"376","two students were assaulted by a group of up to ten people as they walked away from supermacs in eyre square late one night, a court has heard.",152,42,40
"377","senator trevor  clochartaigh has been appointed communications manager with tg4, which means hes set to resign his position in the seanad.",26,6,5
"378","baboro international arts festival for children, in association with galway community circus
had a flash mob performance by children in the eyre square shopping centre on sunday to mark the final day of wide eyes, the one-off european arts extravaganza for children aged up to 6 years. (video: joe oshaughnessy)",46,3,18
